{
  "$schema": "https://json-schema.org/draft/2020-12/schema",
  "type": "object",
  "required": [
    "_id",
    "__v",
    "email",
    "password",
    "username"
  ],
  "properties": {
    "_id": {
      "$ref": "#/$defs/ObjectId"
    },
    "__v": {
      "type": "integer"
    },
    "email": {
      "type": "string"
    },
    "password": {
      "type": "string"
    },
    "unique_id": {
      "type": "integer"
    },
    "username": {
      "type": "string"
    }
  },
  "$defs": {
    "ObjectId": {
      "type": "object",
      "properties": {
        "$oid": {
          "type": "string",
          "pattern": "^[0-9a-fA-F]{24}$"
        }
      },
      "required": [
        "$oid"
      ],
      "additionalProperties": false
    }
  }
}